{
  "protocol": "atenea.remote.v1",
  "version": "1.0.0",
  "message_type": "event",
  "session_id": "session-1",
  "device_id": "device-1",
  "sequence": 0,
  "sent_at": 0,
  "payload": {
    "event_id": "event-1",
    "event_type": "revoked",
    "occurred_at": 0,
    "data": {
      "kind": "revoked",
      "scope": "session",
      "revocation_id": "event-1",
      "reason": "administrator",
      "effective_at": 0
    }
  }
}
