{
  "protocol": "atenea.remote.v1",
  "version": "1.0.0",
  "message_type": "result",
  "session_id": "session-1",
  "device_id": "device-1",
  "request_id": "request-1",
  "sequence": 0,
  "sent_at": 0,
  "payload": {"status": "succeeded", "completed_at": 0, "data": {"kind": "apps", "items": [{"application_id": "app-1", "process": "demo", "window_count": 1}]}}
}
