{
  "protocol": "atenea.remote.v1",
  "version": "1.1.0",
  "message_type": "result",
  "session_id": "session-1",
  "device_id": "device-1",
  "request_id": "request-1",
  "sequence": 0,
  "sent_at": 0,
  "payload": {"status": "succeeded", "completed_at": 0, "data": {"kind": "screenshot", "target_id": "window-1", "target_kind": "window", "owner_process": "demo", "sensitivity": "non_sensitive", "visible": false, "generation": 1, "observed_at": 0, "target_fingerprint": "0123456789abcdef", "visibility": "unknown", "focus": "unknown", "binary": {"kind": "binary_frame", "binary_id": "binary-1", "frame_id": "frame-1", "purpose": "screenshot", "content_type": "image/png", "size_bytes": 1, "sha256": "0000000000000000000000000000000000000000000000000000000000000000", "privacy": {"sensitivity": "non_sensitive", "ephemeral": true, "retention_ms": 1, "artifact_persistence_authorized": false}}}}
}
