{
  "protocol": "atenea.remote.v1",
  "version": "1.0.0",
  "message_type": "request",
  "session_id": "session-1",
  "device_id": "device-1",
  "request_id": "request-apps",
  "sequence": 0,
  "sent_at": 0,
  "payload": {
    "capability": "remote.desktop.apps",
    "mode": "background",
    "authorization": {
      "grant_reference": "grant-1",
      "granted_at": 0,
      "validity_ms": 1,
      "lease_ms": 1
    },
    "timeout_ms": 30000,
    "arguments": {
      "scope": "policy_visible"
    }
  }
}
